{
  "task_id": "wt-invoice-rounding-001",
  "goal": "Fix invoice totals that round each line item instead of rounding once at the total",
  "acceptance_criteria": [
    {
      "criterion": "Line items are summed at full precision and the total is rounded once to 2 decimals",
      "proving_command": "pytest billing/tests/test_invoice.py"
    },
    {
      "criterion": "Existing invoices with single line items are unchanged",
      "proving_command": "pytest billing/tests/test_invoice.py"
    },
    {
      "criterion": "A regression test reproduces the reported off-by-one-cent bug",
      "proving_command": "pytest billing/tests/test_invoice.py::test_multiline_total_rounds_once"
    }
  ],
  "constraints": [
    "No change to the public Invoice API shape",
    "No new dependencies"
  ],
  "non_goals": [
    "Currency/locale formatting changes",
    "Tax calculation changes"
  ],
  "assumptions": [
    "All amounts are in minor units handled as Decimal, confirmed in billing/money.py"
  ],
  "risk_tier": "medium",
  "task_class": "medium",
  "implementer": "implementer-agent",
  "security_sensitive": false,
  "validation_contract": {
    "goal": "Round multi-line invoice totals once at the summed total, not per line item",
    "acceptance_criteria": [
      "Line items summed at full precision; total rounded once to 2 decimals",
      "Single-line invoices unchanged",
      "Regression test reproduces the off-by-one-cent bug"
    ],
    "evidence": [
      "pytest billing/tests/test_invoice.py::test_multiline_total_rounds_once -> red before, green after",
      "pytest billing/tests/test_invoice.py -> 14 passed",
      "mypy billing -> clean"
    ]
  },
  "independent_review": {
    "reviewer": "fresh-reviewer-agent",
    "fresh_context": true,
    "patched": false,
    "verdict": "approve",
    "findings": []
  },
  "completion_record": {
    "goal": "Round multi-line invoice totals once at the summed total",
    "acceptance_criteria": [
      "Total rounds once; single-line invoices unchanged; regression test added"
    ],
    "evidence": [
      "pytest billing/tests/test_invoice.py -> 14 passed (incl. new regression test)",
      "mypy billing -> clean",
      "fresh-context review: approve"
    ]
  },
  "verification_plan": [
    "Add a failing unit test that reproduces the rounding bug",
    "Run the billing unit suite",
    "Typecheck the billing package"
  ],
  "repo_map": {
    "entry_points": ["billing/invoice.py:Invoice.total"],
    "likely_files": ["billing/invoice.py", "billing/tests/test_invoice.py"],
    "callers_checked": ["api/routes/invoices.py:get_invoice"],
    "tests": ["billing/tests/test_invoice.py"],
    "patterns_to_follow": ["Decimal quantize with ROUND_HALF_UP used in billing/money.py"]
  },
  "minimality_decision": {
    "rung": "one_liner",
    "reason": "Move the single quantize() call from per-line-item to the summed total; the summation and Decimal handling already exist.",
    "rejected_lower_rungs": [
      {"rung": "skip", "why_not": "Totals are demonstrably wrong by one cent on multi-line invoices."},
      {"rung": "delete", "why_not": "No dead code is responsible; the rounding location is the bug."},
      {"rung": "reuse", "why_not": "Reuse applies — the existing quantize helper is reused; the change is where it is called."}
    ],
    "safety_exceptions_checked": ["validation", "data_loss"]
  },
  "plan": [
    "Sum line items at full Decimal precision",
    "Quantize the total once to 2 decimals with the existing ROUND_HALF_UP helper",
    "Add a regression test for a 3-line invoice that previously mis-rounded"
  ],
  "commands_run": [
    {"cmd": "pytest billing/tests/test_invoice.py::test_multiline_total_rounds_once", "class": "unit", "result": "pass", "evidence": "Red-green: failed before fix (expected 10.00, got 10.01), passes after the rounding move"},
    {"cmd": "pytest billing/tests/test_invoice.py", "class": "unit", "result": "pass", "evidence": "14 passed after fix, including new regression test"},
    {"cmd": "mypy billing", "class": "typecheck", "result": "pass", "evidence": "no issues found in 9 source files"}
  ],
  "open_risks": [
    "Banker's rounding vs ROUND_HALF_UP could differ for .005 cases; confirmed ROUND_HALF_UP matches existing money.py policy"
  ],
  "review_findings": [
    "Fresh-context review: diff matches contract; rounding moved to total; regression test covers the reported case; no API change. Verdict: approve."
  ],
  "next_action": "Package PR using assets/pr-summary-template.md",
  "status": "package"
}
